{
  "$schema": "https://json-schema.org/draft/2020-12/schema",
  "$id": "https://moeka.dev/schemas/usage-record.v1.schema.json",
  "title": "usage-record.v1",
  "description": "One model call attempt, or one response-cache hit that avoided a call. Content-free: no prompt, response or reasoning text. See ATTRIBUTION.md for field semantics. Additive changes bump the minor in schema_version and keep this major; removed or re-meant fields bump the major and the $id. Merge key across producers: (producer.name, record_id). Enum-valued fields may gain values in a minor: readers must treat an unknown value as opaque, not as an error (ATTRIBUTION.md, reader rule).",
  "type": "object",
  "required": [
    "schema_version", "record_id", "kind", "call_id", "attempt", "consumer",
    "model", "provider", "tokens_in", "tokens_out", "usage_source",
    "cost_usd", "cost_billed", "price_source", "cache_hit", "outcome"
  ],
  "properties": {
    "schema_version": {
      "type": "string", "pattern": "^1\\.[0-9]+$",
      "description": "Major is fixed by this schema; minor counts additive changes."
    },
    "record_id": {
      "type": "string", "minLength": 1,
      "description": "Unique within a producer: '<call_id>:<attempt>' (attempt 0 for a cache hit). Two producers may collide, so the merge/idempotency key is (producer.name, record_id); a duplicate delivery of the same key is the same record. Referenced by complete-json-call.v1."
    },
    "kind": {
      "enum": ["model_call", "cache_hit"],
      "description": "model_call: one physical provider attempt. cache_hit: a response cache answered; billed tokens are zero and saved_* say what it avoided."
    },
    "call_id": {"type": "string", "minLength": 1, "description": "One logical call; every attempt of it shares this id."},
    "attempt": {"type": "integer", "minimum": 0, "description": "1-based physical attempt of the logical call; 0 for a cache hit."},

    "consumer": {"type": "string", "minLength": 1, "description": "The program or product on whose behalf the call ran (awork, awork-resume, gateway, rsi-harness). The literal 'unattributed' marks a defect."},
    "agent": {"type": ["string", "null"], "description": "Agent name (kernel agent spec name, or a pipeline actor)."},
    "session": {"type": ["string", "null"], "description": "Session or run id: a chat session key, a build id, a rollout id."},
    "role": {"type": ["string", "null"], "description": "Functional role of the call (maker, checker, extractor, judge...)."},
    "purpose": {"type": ["string", "null"], "description": "Task type or stage name (extract_claims, fluff_check)."},
    "slot": {"type": ["string", "null"], "description": "Schema slot being filled, when the call serves one."},
    "source": {"enum": ["user", "api", "cron", "dream", "system", null], "description": "Coarse legacy origin class; optional."},
    "tags": {"type": "object", "description": "Host-defined extras. Never the carrier of consumer, agent, session or role. Producer limits (not validated here, so a reader never rejects a record for them): at most 16 keys of at most 64 characters, scalar values, strings at most 120 characters, 2 KiB serialised. A value that does not fit is dropped, not clipped, and the producer sets the key moeka.tags_truncated to true. Content (prompts, replies, names of people) does not belong in tags."},

    "trace_id": {"type": ["string", "null"]},
    "parent_call_id": {"type": ["string", "null"], "description": "call_id of the logical call that caused this one (sub-agent, verifier)."},
    "request_key": {"type": ["string", "null"], "description": "Cache/replay key of the request (opaque; see complete-json-call.v1 key_scheme)."},
    "key_scheme": {"type": ["string", "null"], "pattern": "^[a-z0-9_.-]+\\.v[0-9]+$", "description": "How request_key was derived (awr.sha256.v1, moeka.request_key.v1, or your own '<name>.v<N>'). Two request_keys are comparable only under the same scheme; a different scheme can never match, so a cross-producer 'same request' analysis must say which scheme it joined on. null when request_key is null."},
    "prompt_version": {"type": ["string", "null"], "description": "Caller's version label of the prompt template."},

    "started_at_ms": {"type": ["integer", "null"], "minimum": 0, "description": "Unix epoch milliseconds."},
    "latency_ms": {"type": ["number", "null"], "minimum": 0},

    "model": {"type": "string", "minLength": 1},
    "provider": {"type": "string", "minLength": 1},
    "alias": {"type": ["string", "null"], "description": "Host-side model alias or preset name."},
    "tier": {"type": ["string", "null"], "description": "Cost tier (local, cheap, paid...)."},
    "key_fp": {"type": ["string", "null"], "pattern": "^[0-9a-f]{12}$", "description": "Since 1.2. Fingerprint of the API key that paid for the call: the first 12 lowercase hex characters of sha256 of the key (UTF-8, surrounding whitespace removed). Never the key. null when the provider sends no key (OAuth, local) or the producer does not know it, and on a cache hit."},
    "requested_preset": {"type": ["string", "null"], "description": "Since 1.3. Requested routing choice or preset (for example auto, luna, gpu); model/provider identify the actual physical attempt."},
    "fallback_reason": {"type": ["string", "null"], "description": "Since 1.3. Bounded provider error category that caused this attempt to be used as a fallback, such as timeout or connection."},
    "instance_uuid": {"type": ["string", "null"], "pattern": "^[0-9a-f]{32}$", "description": "Since 1.3. Stable UUID of the owning Moeka instance. Null when the host has no instance marker. Never a filesystem path."},

    "tokens_in": {"type": "integer", "minimum": 0, "description": "Billed input tokens, INCLUDING cache reads and cache writes (a provider that reports them separately, as Anthropic does, is normalised by adding them in). Zero on a cache hit."},
    "tokens_out": {"type": "integer", "minimum": 0, "description": "Billed output tokens, INCLUDING reasoning tokens always: a provider that reports reasoning outside its output count (a total above input plus output) is normalised by adding the excess here. Zero on a cache hit."},
    "tokens_cache_read": {"type": ["integer", "null"], "minimum": 0, "description": "Subset of tokens_in served from the provider prompt cache; null = not reported."},
    "tokens_cache_write": {"type": ["integer", "null"], "minimum": 0, "description": "Subset of tokens_in written to the provider prompt cache; null = not reported."},
    "tokens_reasoning": {"type": ["integer", "null"], "minimum": 0, "description": "Hidden reasoning tokens, a SUBSET of tokens_out (never added to it again); null = not reported."},
    "usage_source": {"enum": ["reported", "estimated", "mixed", "none"], "description": "Whether the provider billed these counts or the producer estimated them."},

    "cost_usd": {"type": ["number", "null"], "minimum": 0, "description": "USD cost of this record; null = unknown (never free by default). 0 on a cache hit."},
    "cost_billed": {"type": "boolean", "description": "True when cost_usd is ground truth (provider-reported usage at a known price, or the local-zero convention)."},
    "price_source": {
      "enum": ["provider_reported", "price_table", "local_zero", "cache", "none"],
      "description": "cache: a response cache answered, cost is zero by construction. provider_reported: the provider returned the cost. price_table: tokens times the producer's price table. local_zero: local tier convention. none: no price known (cost_usd null)."
    },

    "cache_hit": {"type": "boolean", "description": "A response cache answered; no provider call was made."},
    "saved_tokens_in": {"type": ["integer", "null"], "minimum": 0, "description": "Input tokens a cache hit avoided; null when not a hit or unknown."},
    "saved_tokens_out": {"type": ["integer", "null"], "minimum": 0, "description": "Output tokens a cache hit avoided."},
    "saved_cost_usd": {"type": ["number", "null"], "minimum": 0, "description": "USD a cache hit avoided (original call's cost); null when unknown."},

    "finish_reason": {"type": ["string", "null"]},
    "outcome": {
      "enum": ["ok", "truncated", "parse_failure", "error", "cancelled", "timeout"],
      "description": "ok: usable result. truncated: hit the token limit. parse_failure: replied but not valid for the schema. error/timeout/cancelled: the attempt failed."
    },
    "error_kind": {"type": ["string", "null"], "description": "Provider/transport error class when outcome is error or timeout."},

    "waste_label": {
      "enum": ["retry", "failover", "avoidable_cache_miss", "discarded_draft", "refused_after_admission", null],
      "description": "Why THESE tokens did not contribute to the final result. retry: this attempt was superseded by a later attempt of the same call (the retry that produced the answer is not waste). Set on the record when known at emission, or by a linked waste-label.v1 document keyed by (call_id, attempt) that readers apply (a retry is only known after the attempt ended)."
    },
    "waste_set_by": {"enum": ["kernel", "caller", "consumer", null]},

    "producer": {
      "type": ["object", "null"],
      "required": ["name"],
      "properties": {"name": {"type": "string"}, "version": {"type": ["string", "null"]}},
      "description": "Software that emitted the record (moeka, awr.llm)."
    }
  },
  "allOf": [
    {
      "if": {"properties": {"kind": {"const": "cache_hit"}}},
      "then": {
        "properties": {
          "cache_hit": {"const": true}, "attempt": {"const": 0},
          "tokens_in": {"const": 0}, "tokens_out": {"const": 0}, "cost_usd": {"const": 0}
        }
      },
      "else": {"properties": {"cache_hit": {"const": false}, "attempt": {"minimum": 1}}}
    },
    {
      "if": {"properties": {"price_source": {"const": "none"}}},
      "then": {"properties": {"cost_usd": {"type": "null"}, "cost_billed": {"const": false}}}
    }
  ],
  "additionalProperties": true
}
