{
  "schema_version": "1.2",
  "record_id": "c-7f3a91:1",
  "kind": "model_call",
  "call_id": "c-7f3a91",
  "attempt": 1,
  "consumer": "awork",
  "agent": "research",
  "session": "build-2026-10-01-a",
  "role": "extractor",
  "purpose": "extract_claims",
  "slot": null,
  "tags": {
    "stage": "ingest"
  },
  "trace_id": "t-19c2",
  "request_key": "9b1d5e0c44aa81f2",
  "prompt_version": "extract-v3",
  "started_at_ms": 1790000000000,
  "latency_ms": 812.4,
  "model": "gpt-5-mini",
  "provider": "openrouter",
  "alias": "cheap",
  "tier": "cheap",
  "key_fp": "3f9c2a7b1d04",
  "tokens_in": 1200,
  "tokens_out": 340,
  "tokens_cache_read": 800,
  "tokens_cache_write": 0,
  "tokens_reasoning": null,
  "usage_source": "reported",
  "cost_usd": 0.00098,
  "cost_billed": true,
  "price_source": "price_table",
  "cache_hit": false,
  "saved_tokens_in": null,
  "saved_tokens_out": null,
  "saved_cost_usd": null,
  "finish_reason": "stop",
  "outcome": "parse_failure",
  "error_kind": null,
  "waste_label": "retry",
  "waste_set_by": "kernel",
  "producer": {
    "name": "moeka",
    "version": "0.1"
  },
  "key_scheme": "moeka.request_key.v1"
}
